"icd_code","icd_version","long_title"
"C6212",10,"Malignant neoplasm of descended left testis"
"F449",10,"Dissociative and conversion disorder, unspecified"
"T501X5A",10,"Adverse effect of loop [high-ceiling] diuretics, initial encounter"
"T451X5A",10,"Adverse effect of antineoplastic and immunosuppressive drugs, initial encounter"
"E6601",10,"Morbid (severe) obesity due to excess calories"
"Z9049",10,"Acquired absence of other specified parts of digestive tract"
"R001",10,"Bradycardia, unspecified"
"M19019",10,"Primary osteoarthritis, unspecified shoulder"
"F323",10,"Major depressive disorder, single episode, severe with psychotic features"
"C9111",10,"Chronic lymphocytic leukemia of B-cell type in remission"
"T383X1A",10,"Poisoning by insulin and oral hypoglycemic [antidiabetic] drugs, accidental (unintentional), initial encounter"
"M109",10,"Gout, unspecified"
"Y929",10,"Unspecified place or not applicable"
"M533",10,"Sacrococcygeal disorders, not elsewhere classified"
"R51",10,"Headache"
"R0789",10,"Other chest pain"
"R569",10,"Unspecified convulsions"
"Z8547",10,"Personal history of malignant neoplasm of testis"
"R61",10,"Generalized hyperhidrosis"
"R638",10,"Other symptoms and signs concerning food and fluid intake"
"R1013",10,"Epigastric pain"
"Z8719",10,"Personal history of other diseases of the digestive system"
"R748",10,"Abnormal levels of other serum enzymes"
"I309",10,"Acute pericarditis, unspecified"
"Z7984",10,"Long term (current) use of oral hypoglycemic drugs"
"F09",10,"Unspecified mental disorder due to known physiological condition"
"F325",10,"Major depressive disorder, single episode, in full remission"
"I69344",10,"Monoplegia of lower limb following cerebral infarction affecting left non-dominant side"
"I495",10,"Sick sinus syndrome"
"F447",10,"Conversion disorder with mixed symptom presentation"
"L299",10,"Pruritus, unspecified"
"H53462",10,"Homonymous bilateral field defects, left side"
"E11649",10,"Type 2 diabetes mellitus with hypoglycemia without coma"
"H8110",10,"Benign paroxysmal vertigo, unspecified ear"
"R2240",10,"Localized swelling, mass and lump, unspecified lower limb"
"R509",10,"Fever, unspecified"
"F05",10,"Delirium due to known physiological condition"
"C6290",10,"Malignant neoplasm of unspecified testis, unspecified whether descended or undescended"
"I493",10,"Ventricular premature depolarization"
"Z5111",10,"Encounter for antineoplastic chemotherapy"
"E781",10,"Pure hyperglyceridemia"
"M19012",10,"Primary osteoarthritis, left shoulder"
"T508X5A",10,"Adverse effect of diagnostic agents, initial encounter"
"Y92238",10,"Other place in hospital as the place of occurrence of the external cause"
"M160",10,"Bilateral primary osteoarthritis of hip"
"R7989",10,"Other specified abnormal findings of blood chemistry"
"N141",10,"Nephropathy induced by other drugs, medicaments and biological substances"
"L853",10,"Xerosis cutis"
"K289",10,"Gastrojejunal ulcer, unspecified as acute or chronic, without hemorrhage or perforation"
"R5383",10,"Other fatigue"
"K9589",10,"Other complications of other bariatric procedure"
"K316",10,"Fistula of stomach and duodenum"
"M19011",10,"Primary osteoarthritis, right shoulder"
"F3340",10,"Major depressive disorder, recurrent, in remission, unspecified"
"T402X5A",10,"Adverse effect of other opioids, initial encounter"
"I69354",10,"Hemiplegia and hemiparesis following cerebral infarction affecting left non-dominant side"
"R319",10,"Hematuria, unspecified"
"M7071",10,"Other bursitis of hip, right hip"
"F0390",10,"Unspecified dementia without behavioral disturbance"
"K635",10,"Polyp of colon"
"K625",10,"Hemorrhage of anus and rectum"
"K648",10,"Other hemorrhoids"
"R791",10,"Abnormal coagulation profile"
"M549",10,"Dorsalgia, unspecified"
"K6389",10,"Other specified diseases of intestine"
"M25519",10,"Pain in unspecified shoulder"
"I481",10,"Persistent atrial fibrillation"
"G629",10,"Polyneuropathy, unspecified"
"E0865",10,"Diabetes mellitus due to underlying condition with hyperglycemia"
"G8194",10,"Hemiplegia, unspecified affecting left nondominant side"
"R600",10,"Localized edema"
"R1030",10,"Lower abdominal pain, unspecified"
"M1990",10,"Unspecified osteoarthritis, unspecified site"
"M719",10,"Bursopathy, unspecified"
"G3184",10,"Mild cognitive impairment, so stated"
"I314",10,"Cardiac tamponade"
"I313",10,"Pericardial effusion (noninflammatory)"
"M940",10,"Chondrocostal junction syndrome [Tietze]"
"F1020",10,"Alcohol dependence, uncomplicated"
"A4189",10,"Other specified sepsis"
"E46",10,"Unspecified protein-calorie malnutrition"
"K859",10,"Acute pancreatitis, unspecified"
"K7010",10,"Alcoholic hepatitis without ascites"
"E5112",10,"Wet beriberi"
"R64",10,"Cachexia"
"K7460",10,"Unspecified cirrhosis of liver"
"T8242XA",10,"Displacement of vascular dialysis catheter, initial encounter"
"Y828",10,"Other medical devices associated with adverse incidents"
"E59",10,"Dietary selenium deficiency"
"I82401",10,"Acute embolism and thrombosis of unspecified deep veins of right lower extremity"
"I5021",10,"Acute systolic (congestive) heart failure"
"R34",10,"Anuria and oliguria"
"D124",10,"Benign neoplasm of descending colon"
"D61818",10,"Other pancytopenia"
"K7030",10,"Alcoholic cirrhosis of liver without ascites"
"J690",10,"Pneumonitis due to inhalation of food and vomit"
"J9691",10,"Respiratory failure, unspecified with hypoxia"
"Z681",10,"Body mass index (BMI) 19.9 or less, adult"
"K5730",10,"Diverticulosis of large intestine without perforation or abscess without bleeding"
"E873",10,"Alkalosis"
"G9340",10,"Encephalopathy, unspecified"
"I5181",10,"Takotsubo syndrome"
"R680",10,"Hypothermia, not associated with low environmental temperature"
"E60",10,"Dietary zinc deficiency"
"2651",9,"Other and unspecified manifestations of thiamine deficiency"
"K921",10,"Melena"
"S0003XA",10,"Contusion of scalp, initial encounter"
"W108XXA",10,"Fall (on) (from) other stairs and steps, initial encounter"
"S20221A",10,"Contusion of right back wall of thorax, initial encounter"
"S40022A",10,"Contusion of left upper arm, initial encounter"
"S20222A",10,"Contusion of left back wall of thorax, initial encounter"
"Z8711",10,"Personal history of peptic ulcer disease"
"S40021A",10,"Contusion of right upper arm, initial encounter"
"S8012XA",10,"Contusion of left lower leg, initial encounter"
"K7040",10,"Alcoholic hepatic failure without coma"
"S8011XA",10,"Contusion of right lower leg, initial encounter"
"F10251",10,"Alcohol dependence with alcohol-induced psychotic disorder with hallucinations"
"Y92018",10,"Other place in single-family (private) house as the place of occurrence of the external cause"
"Z91128",10,"Patient's intentional underdosing of medication regimen for other reason"
"F1019",10,"Alcohol abuse with unspecified alcohol-induced disorder"
"T473X6A",10,"Underdosing of saline and osmotic laxatives, initial encounter"
"D539",10,"Nutritional anemia, unspecified"
"Z980",10,"Intestinal bypass and anastomosis status"
"K284",10,"Chronic or unspecified gastrojejunal ulcer with hemorrhage"
"R300",10,"Dysuria"
"K861",10,"Other chronic pancreatitis"
"I8511",10,"Secondary esophageal varices with bleeding"
"N281",10,"Cyst of kidney, acquired"
"K8520",10,"Alcohol induced acute pancreatitis without necrosis or infection"
"K7681",10,"Hepatopulmonary syndrome"
"K7011",10,"Alcoholic hepatitis with ascites"
"Z6830",10,"Body mass index (BMI) 30.0-30.9, adult"
"D689",10,"Coagulation defect, unspecified"
"N184",10,"Chronic kidney disease, stage 4 (severe)"
"K860",10,"Alcohol-induced chronic pancreatitis"
"V08",9,"Asymptomatic human immunodeficiency virus [HIV] infection status"
"07071",9,"Unspecified viral hepatitis C with hepatic coma"
"29680",9,"Bipolar disorder, unspecified"
"V462",9,"Other dependence on machines, supplemental oxygen"
"V462",10,"Person on outside of car injured in collision with other nonmotor vehicle in nontraffic accident"
"07044",9,"Chronic hepatitis C with hepatic coma"
"V1271",9,"Personal history of peptic ulcer disease"
"2989",9,"Unspecified psychosis"
"7813",9,"Lack of coordination"
"7260",9,"Adhesive capsulitis of shoulder"
"V1588",9,"History of fall"
"K3580",10,"Unspecified acute appendicitis"
"Z801",10,"Family history of malignant neoplasm of trachea, bronchus and lung"
"M545",10,"Low back pain"
"C029",10,"Malignant neoplasm of tongue, unspecified"
"Z8049",10,"Family history of malignant neoplasm of other genital organs"
"6273",9,"Postmenopausal atrophic vaginitis"
"25022",9,"Diabetes with hyperosmolarity, type II or unspecified type, uncontrolled"
"61650",9,"Ulceration of vulva, unspecified"
"1419",9,"Malignant neoplasm of tongue, unspecified"
"7919",9,"Other nonspecific findings on examination of urine"
"9623",9,"Poisoning by insulins and antidiabetic agents"
"75249",9,"Other anomalies of cervix, vagina, and external female genitalia"
"78065",9,"Hypothermia not associated with low environmental temperature"
"E8580",9,"Accidental poisoning by hormones and synthetic substitutes"
"V1302",9,"Personal history, urinary (tract) infection"
"4870",9,"Influenza with pneumonia"
"1121",9,"Candidiasis of vulva and vagina"
"00845",9,"Intestinal infection due to Clostridium difficile"
"33829",9,"Other chronic pain"
"99931",9,"Other and unspecified infection due to central venous catheter"
"6824",9,"Cellulitis and abscess of hand, except fingers and thumb"
"38531",9,"Cholesteatoma of attic"
"38010",9,"Infective otitis externa, unspecified"
"S2232XA",10,"Fracture of one rib, left side, initial encounter for closed fracture"
"Z85810",10,"Personal history of malignant neoplasm of tongue"
"S22068A",10,"Other fracture of T7-T8 thoracic vertebra, initial encounter for closed fracture"
"R1012",10,"Left upper quadrant pain"
"9243",9,"Contusion of toe"
"23871",9,"Essential thrombocythemia"
"59969",9,"Urinary obstruction, not elsewhere classified"
"4660",9,"Acute bronchitis"
"4940",9,"Bronchiectasis without acute exacerbation"
"D89813",10,"Graft-versus-host disease, unspecified"
"B59",10,"Pneumocystosis"
"H1133",10,"Conjunctival hemorrhage, bilateral"
"R5081",10,"Fever presenting with conditions classified elsewhere"
"Z9484",10,"Stem cells transplant status"
"R042",10,"Hemoptysis"
"Z781",10,"Physical restraint status"
"D709",10,"Neutropenia, unspecified"
"J159",10,"Unspecified bacterial pneumonia"
"Z9012",10,"Acquired absence of left breast and nipple"
"G893",10,"Neoplasm related pain (acute) (chronic)"
"B441",10,"Other pulmonary aspergillosis"
"C92Z0",10,"Other myeloid leukemia not having achieved remission"
"99933",9,"Local infection due to central venous catheter"
"28419",9,"Other pancytopenia"
"4846",9,"Pneumonia in aspergillosis"
"1173",9,"Aspergillosis"
"20500",9,"Acute myeloid leukemia, without mention of having achieved remission"
"V6402",9,"Vaccination not carried out because of chronic illness or condition"
"4809",9,"Viral pneumonia, unspecified"
"28804",9,"Neutropenia due to infection"
"E9348",9,"Other agents affecting blood constituents causing adverse effects in therapeutic use"
"5733",9,"Hepatitis, unspecified"
"99932",9,"Bloodstream infection due to central venous catheter"
"78061",9,"Fever presenting with conditions classified elsewhere"
"7907",9,"Bacteremia"
"61172",9,"Lump or mass in breast"
"3393",9,"Drug induced headache, not elsewhere classified"
"E9319",9,"Other and unspecified anti-infectives causing adverse effects in therapeutic use"
"V160",9,"Family history of malignant neoplasm of gastrointestinal tract"
"V160",10,"Pedal cycle driver injured in collision with other nonmotor vehicle in nontraffic accident"
"78605",9,"Shortness of breath"
"V4281",9,"Bone marrow replaced by transplant"
"V8739",9,"Contact with and (suspected) exposure to other potentially hazardous substances"
"V4571",9,"Acquired absence of breast and nipple"
"T361X5A",10,"Adverse effect of cephalosporins and other beta-lactam antibiotics, initial encounter"
"Z792",10,"Long term (current) use of antibiotics"
"Z79810",10,"Long term (current) use of selective estrogen receptor modulators (SERMs)"
"Z6826",10,"Body mass index (BMI) 26.0-26.9, adult"
"R634",10,"Abnormal weight loss"
"G44209",10,"Tension-type headache, unspecified, not intractable"
"Z20828",10,"Contact with and (suspected) exposure to other viral communicable diseases"
"C92Z2",10,"Other myeloid leukemia, in relapse"
"I951",10,"Orthostatic hypotension"
"K521",10,"Toxic gastroenteritis and colitis"
"C9202",10,"Acute myeloblastic leukemia, in relapse"
"7905",9,"Other nonspecific abnormal serum enzyme levels"
"V5811",9,"Encounter for antineoplastic chemotherapy"
"20501",9,"Acute myeloid leukemia, in remission"
"1759",9,"Malignant neoplasm of other and unspecified sites of male breast"
"2330",9,"Carcinoma in situ of breast"
"V169",9,"Family history of unspecified malignant neoplasm"
"V169",10,"Unspecified pedal cyclist injured in collision with other nonmotor vehicle in traffic accident"
"V860",9,"Estrogen receptor positive status [ER+]"
"V860",10,"Driver of special all-terrain or other off-road motor vehicle injured in traffic accident"
"7830",9,"Anorexia"
"28411",9,"Antineoplastic chemotherapy induced pancytopenia"
"V141",9,"Personal history of allergy to other antibiotic agent"
"V141",10,"Pedal cycle passenger injured in collision with heavy transport vehicle or bus in nontraffic accident"
"78702",9,"Nausea alone"
"3004",9,"Dysthymic disorder"
"515",9,"Postinflammatory pulmonary fibrosis"
"E8706",9,"Accidental cut, puncture, perforation or hemorrhage during heart catheterization"
"9168",9,"Other and unspecified superficial injury of hip, thigh, leg, and ankle, without mention of infection"
"5168",9,"Other specified alveolar and parietoalveolar pneumonopathies"
"V8542",9,"Body Mass Index 45.0-49.9, adult"
"45981",9,"Venous (peripheral) insufficiency, unspecified"
"11289",9,"Other candidiasis of other specified sites"
"E9289",9,"Unspecified accident"
"8449",9,"Sprains and strains of unspecified site of knee and leg"
"3940",9,"Mitral stenosis"
"5730",9,"Chronic passive congestion of liver"
"V8801",9,"Acquired absence of both cervix and uterus"
"I739",10,"Peripheral vascular disease, unspecified"
"N319",10,"Neuromuscular dysfunction of bladder, unspecified"
"Z86711",10,"Personal history of pulmonary embolism"
"C73",10,"Malignant neoplasm of thyroid gland"
"V8521",9,"Body Mass Index 25.0-25.9, adult"
"5589",9,"Other and unspecified noninfectious gastroenteritis and colitis"
"73300",9,"Osteoporosis, unspecified"
"59654",9,"Neurogenic bladder NOS"
"2411",9,"Nontoxic multinodular goiter"
"4414",9,"Abdominal aneurysm without mention of rupture"
"J398",10,"Other specified diseases of upper respiratory tract"
"I82622",10,"Acute embolism and thrombosis of deep veins of left upper extremity"
"J9622",10,"Acute and chronic respiratory failure with hypercapnia"
"K5790",10,"Diverticulosis of intestine, part unspecified, without perforation or abscess without bleeding"
"M19072",10,"Primary osteoarthritis, left ankle and foot"
"K8020",10,"Calculus of gallbladder without cholecystitis without obstruction"
"E042",10,"Nontoxic multinodular goiter"
"M1000",10,"Idiopathic gout, unspecified site"
"Z6829",10,"Body mass index (BMI) 29.0-29.9, adult"
"4150",9,"Acute cor pulmonale"
"7842",9,"Swelling, mass, or lump in head and neck"
"0413",9,"Friedlnder's bacillus infection in conditions classified elsewhere and of unspecified site"
"7804",9,"Dizziness and giddiness"
"E0520",10,"Thyrotoxicosis with toxic multinodular goiter without thyrotoxic crisis or storm"
"N400",10,"Benign prostatic hyperplasia without lower urinary tract symptoms"
"R5381",10,"Other malaise"
"L03116",10,"Cellulitis of left lower limb"
"H3530",10,"Unspecified macular degeneration"
"Q6432",10,"Congenital stricture of urethra"
"F4329",10,"Adjustment disorder with other symptoms"
"Z953",10,"Presence of xenogenic heart valve"
"Z87442",10,"Personal history of urinary calculi"
"I5042",10,"Chronic combined systolic (congestive) and diastolic (congestive) heart failure"
"T81718A",10,"Complication of other artery following a procedure, not elsewhere classified, initial encounter"
"N401",10,"Benign prostatic hyperplasia with lower urinary tract symptoms"
"I482",10,"Chronic atrial fibrillation"
"T370X5A",10,"Adverse effect of sulfonamides, initial encounter"
"I724",10,"Aneurysm of artery of lower extremity"
"D702",10,"Other drug-induced agranulocytosis"
"L723",10,"Sebaceous cyst"
"B964",10,"Proteus (mirabilis) (morganii) as the cause of diseases classified elsewhere"
"R3911",10,"Hesitancy of micturition"
"Z923",10,"Personal history of irradiation"
"C946",10,"Myelodysplastic disease, not classified"
"C9590",10,"Leukemia, unspecified not having achieved remission"
"K264",10,"Chronic or unspecified duodenal ulcer with hemorrhage"
"Z6833",10,"Body mass index (BMI) 33.0-33.9, adult"
"R823",10,"Hemoglobinuria"
"D599",10,"Acquired hemolytic anemia, unspecified"
"D46Z",10,"Other myelodysplastic syndromes"
"E790",10,"Hyperuricemia without signs of inflammatory arthritis and tophaceous disease"
"I2720",10,"Pulmonary hypertension, unspecified"
"6202",9,"Other and unspecified ovarian cyst"
"4928",9,"Other emphysema"
"M351",10,"Other overlap syndromes"
"D735",10,"Infarction of spleen"
"R161",10,"Splenomegaly, not elsewhere classified"
"R109",10,"Unspecified abdominal pain"
"D469",10,"Myelodysplastic syndrome, unspecified"
"J60",10,"Coalworker's pneumoconiosis"
"B009",10,"Herpesviral infection, unspecified"
"Y842",10,"Radiological procedure and radiotherapy as the cause of abnormal reaction of the patient, or of later complication, without mention of misadventure at the time of the procedure"
"Z1611",10,"Resistance to penicillins"
"B961",10,"Klebsiella pneumoniae [K. pneumoniae] as the cause of diseases classified elsewhere"
"K259",10,"Gastric ulcer, unspecified as acute or chronic, without hemorrhage or perforation"
"T504X5A",10,"Adverse effect of drugs affecting uric acid metabolism, initial encounter"
"D471",10,"Chronic myeloproliferative disease"
"L271",10,"Localized skin eruption due to drugs and medicaments taken internally"
"I6340",10,"Cerebral infarction due to embolism of unspecified cerebral artery"
"I69893",10,"Ataxia following other cerebrovascular disease"
"R2681",10,"Unsteadiness on feet"
"G8191",10,"Hemiplegia, unspecified affecting right dominant side"
"I69392",10,"Facial weakness following cerebral infarction"
"D72819",10,"Decreased white blood cell count, unspecified"
"72989",9,"Other musculoskeletal symptoms referable to limbs"
"43889",9,"Other late effects of cerebrovascular disease"
"F309",10,"Manic episode, unspecified"
"R12",10,"Heartburn"
"J9809",10,"Other diseases of bronchus, not elsewhere classified"
"R1319",10,"Other dysphagia"
"C3490",10,"Malignant neoplasm of unspecified part of unspecified bronchus or lung"
"B370",10,"Candidal stomatitis"
"M797",10,"Fibromyalgia"
"B9562",10,"Methicillin resistant Staphylococcus aureus infection as the cause of diseases classified elsewhere"
"K222",10,"Esophageal obstruction"
"C3402",10,"Malignant neoplasm of left main bronchus"
"Z8701",10,"Personal history of pneumonia (recurrent)"
"M5430",10,"Sciatica, unspecified side"
"R1310",10,"Dysphagia, unspecified"
"B379",10,"Candidiasis, unspecified"
"C3401",10,"Malignant neoplasm of right main bronchus"
"99674",9,"Other complications due to other vascular device, implant, and graft"
"1571",9,"Malignant neoplasm of body of pancreas"
"56889",9,"Other specified disorders of peritoneum"
"4568",9,"Varices of other sites"
"78094",9,"Early satiety"
"4471",9,"Stricture of artery"
"1977",9,"Malignant neoplasm of liver, secondary"
"99731",9,"Ventilator associated pneumonia"
"V4611",9,"Dependence on respirator, status"
"E9358",9,"Other specified analgesics and antipyretics causing adverse effects in therapeutic use"
"5921",9,"Calculus of ureter"
"1541",9,"Malignant neoplasm of rectum"
"V1351",9,"Personal history of pathologic fracture"
"V446",9,"Other artificial opening of urinary tract status"
"V446",10,"Car passenger injured in collision with heavy transport vehicle or bus in traffic accident"
"56942",9,"Anal or rectal pain"
"E9342",9,"Anticoagulants causing adverse effects in therapeutic use"
"E9320",9,"Adrenal cortical steroids causing adverse effects in therapeutic use"
"5934",9,"Other ureteric obstruction"
"78079",9,"Other malaise and fatigue"
"1543",9,"Malignant neoplasm of anus, unspecified site"
"71596",9,"Osteoarthrosis, unspecified whether generalized or localized, lower leg"
"2555",9,"Other adrenal hypofunction"
"E9478",9,"Other drugs and medicinal substances causing adverse effects in therapeutic use"
"1122",9,"Candidiasis of other urogenital sites"
"42832",9,"Chronic diastolic heart failure"
"28412",9,"Other drug-induced pancytopenia"
"1548",9,"Malignant neoplasm of other sites of rectum, rectosigmoid junction, and anus"
"71536",9,"Osteoarthrosis, localized, not specified whether primary or secondary, lower leg"
"59972",9,"Microscopic hematuria"
"C211",10,"Malignant neoplasm of anal canal"
"M179",10,"Osteoarthritis of knee, unspecified"
"K311",10,"Adult hypertrophic pyloric stenosis"
"T8359XA",10,"Infection and inflammatory reaction due to prosthetic device, implant and graft in urinary system, initial encounter"
"C7889",10,"Secondary malignant neoplasm of other digestive organs"
"Z433",10,"Encounter for attention to colostomy"
"C786",10,"Secondary malignant neoplasm of retroperitoneum and peritoneum"
"Q620",10,"Congenital hydronephrosis"
"K5660",10,"Unspecified intestinal obstruction"
"N12",10,"Tubulo-interstitial nephritis, not specified as acute or chronic"
"T8131XA",10,"Disruption of external operation (surgical) wound, not elsewhere classified, initial encounter"
"81600",9,"Closed fracture of phalanx or phalanges of hand, unspecified"
"V6441",9,"Laparoscopic surgical procedure converted to open procedure"
"E887",9,"Fracture, cause unspecified"
"99809",9,"Postoperative shock, other"
"V8533",9,"Body Mass Index 33.0-33.9, adult"
"99594",9,"Systemic inflammatory response syndrome due to noninfectious process with acute organ dysfunction"
"56089",9,"Other specified intestinal obstruction"
"45383",9,"Acute venous embolism and thrombosis of upper extremity, unspecified"
"55320",9,"Ventral, unspecified, hernia without mention of obstruction or gangrene"
"99604",9,"Mechanical complication of automatic implantable cardiac defibrillator"
"E8498",9,"Accidents occurring in other specified places"
"4263",9,"Other left bundle branch block"
"E8768",9,"Other specified misadventures during medical care"
"29532",9,"Paranoid type schizophrenia, chronic"
"9961",9,"Mechanical complication of other vascular device, implant, and graft"
"4259",9,"Secondary cardiomyopathy, unspecified"
"V1052",9,"Personal history of malignant neoplasm of kidney"
"29530",9,"Paranoid type schizophrenia, unspecified"
"7852",9,"Undiagnosed cardiac murmurs"
"T43505S",10,"Adverse effect of unspecified antipsychotics and neuroleptics, sequela"
"Z85528",10,"Personal history of other malignant neoplasm of kidney"
"I427",10,"Cardiomyopathy due to drug and external agent"
"F200",10,"Paranoid schizophrenia"
"I081",10,"Rheumatic disorders of both mitral and tricuspid valves"
"Z905",10,"Acquired absence of kidney"
"I071",10,"Rheumatic tricuspid insufficiency"
"E874",10,"Mixed disorder of acid-base balance"
"I420",10,"Dilated cardiomyopathy"
"T8089XA",10,"Other complications following infusion, transfusion and therapeutic injection, initial encounter"
"Z4502",10,"Encounter for adjustment and management of automatic implantable cardiac defibrillator"
"R112",10,"Nausea with vomiting, unspecified"
"7530",9,"Renal agenesis and dysgenesis"
"V5331",9,"Fitting and adjustment of cardiac pacemaker"
"40491",9,"Hypertensive heart and chronic kidney disease, unspecified, with heart failure and with chronic kidney disease stage I through stage IV, or unspecified"
"V8523",9,"Body Mass Index 27.0-27.9, adult"
"3970",9,"Diseases of tricuspid valve"
"E806",10,"Other disorders of bilirubin metabolism"
"I361",10,"Nonrheumatic tricuspid (valve) insufficiency"
"I428",10,"Other cardiomyopathies"
"7197",9,"Difficulty in walking"
"92320",9,"Contusion of hand(s)"
"E9063",9,"Bite of other animal except arthropod"
"78057",9,"Unspecified sleep apnea"
"7823",9,"Edema"
"71650",9,"Unspecified polyarthropathy or polyarthritis, site unspecified"
"59960",9,"Urinary obstruction, unspecified"
"5305",9,"Dyskinesia of esophagus"
"I082",10,"Rheumatic disorders of both aortic and tricuspid valves"
"4149",9,"Chronic ischemic heart disease, unspecified"
"1741",9,"Malignant neoplasm of central portion of female breast"
"L0591",10,"Pilonidal cyst without abscess"
"I69351",10,"Hemiplegia and hemiparesis following cerebral infarction affecting right dominant side"
"I69322",10,"Dysarthria following cerebral infarction"
"G92",10,"Toxic encephalopathy"
"I69391",10,"Dysphagia following cerebral infarction"
"I5043",10,"Acute on chronic combined systolic (congestive) and diastolic (congestive) heart failure"
"A0472",10,"Enterocolitis due to Clostridium difficile, not specified as recurrent"
"43310",9,"Occlusion and stenosis of carotid artery without mention of cerebral infarction"
"78469",9,"Other symbolic dysfunction"
"43491",9,"Cerebral artery occlusion, unspecified with cerebral infarction"
"82021",9,"Closed fracture of intertrochanteric section of neck of femur"
"43811",9,"Late effects of cerebrovascular disease, aphasia"
"V090",9,"Infection with microorganisms resistant to penicillins"
"V090",10,"Pedestrian injured in nontraffic accident involving other and unspecified motor vehicles"
"5559",9,"Regional enteritis of unspecified site"
"Y92199",10,"Unspecified place in other specified residential institution as the place of occurrence of the external cause"
"S82251A",10,"Displaced comminuted fracture of shaft of right tibia, initial encounter for closed fracture"
"H548",10,"Legal blindness, as defined in USA"
"R21",10,"Rash and other nonspecific skin eruption"
