"icd_code","icd_version","long_title"
"J918",10,"Pleural effusion in other conditions classified elsewhere"
"H540",10,"Blindness, both eyes"
"4473",9,"Hyperplasia of renal artery"
"42830",9,"Diastolic heart failure, unspecified"
"L97429",10,"Non-pressure chronic ulcer of left heel and midfoot with unspecified severity"
"L97229",10,"Non-pressure chronic ulcer of left calf with unspecified severity"
"I70262",10,"Atherosclerosis of native arteries of extremities with gangrene, left leg"
"E11622",10,"Type 2 diabetes mellitus with other skin ulcer"
"E11628",10,"Type 2 diabetes mellitus with other skin complications"
"L97419",10,"Non-pressure chronic ulcer of right heel and midfoot with unspecified severity"
"L97523",10,"Non-pressure chronic ulcer of other part of left foot with necrosis of muscle"
"4401",9,"Atherosclerosis of renal artery"
"30521",9,"Cannabis abuse, continuous"
"6820",9,"Cellulitis and abscess of face"
"V8536",9,"Body Mass Index 36.0-36.9, adult"
"L89899",10,"Pressure ulcer of other site, unspecified stage"
"L97529",10,"Non-pressure chronic ulcer of other part of left foot with unspecified severity"
"R159",10,"Full incontinence of feces"
"Z1623",10,"Resistance to quinolones and fluoroquinolones"
"Z1621",10,"Resistance to vancomycin"
"K5903",10,"Drug induced constipation"
"B952",10,"Enterococcus as the cause of diseases classified elsewhere"
"H34239",10,"Retinal artery branch occlusion, unspecified eye"
"G43109",10,"Migraine with aura, not intractable, without status migrainosus"
"R918",10,"Other nonspecific abnormal finding of lung field"
"E278",10,"Other specified disorders of adrenal gland"
"I701",10,"Atherosclerosis of renal artery"
"J441",10,"Chronic obstructive pulmonary disease with (acute) exacerbation"
"Z800",10,"Family history of malignant neoplasm of digestive organs"
"W208XXA",10,"Other cause of strike by thrown, projected or falling object, initial encounter"
"K5791",10,"Diverticulosis of intestine, part unspecified, without perforation or abscess with bleeding"
"S9032XA",10,"Contusion of left foot, initial encounter"
"I7789",10,"Other specified disorders of arteries and arterioles"
"V8537",9,"Body Mass Index 37.0-37.9, adult"
"25040",9,"Diabetes with renal manifestations, type II or unspecified type, not stated as uncontrolled"
"V0179",9,"Contact with or exposure to other viral diseases"
"71940",9,"Pain in joint, site unspecified"
"36230",9,"Retinal vascular occlusion, unspecified"
"T465X5A",10,"Adverse effect of other antihypertensive drugs, initial encounter"
"30183",9,"Borderline personality disorder"
"G1221",10,"Amyotrophic lateral sclerosis"
"Z930",10,"Tracheostomy status"
"R4182",10,"Altered mental status, unspecified"
"G3109",10,"Other frontotemporal dementia"
"D721",10,"Eosinophilia"
"N10",10,"Acute pyelonephritis"
"B9620",10,"Unspecified Escherichia coli [E. coli] as the cause of diseases classified elsewhere"
"J9610",10,"Chronic respiratory failure, unspecified whether with hypoxia or hypercapnia"
"Z931",10,"Gastrostomy status"
"T360X5A",10,"Adverse effect of penicillins, initial encounter"
"Z430",10,"Encounter for attention to tracheostomy"
"Z4689",10,"Encounter for fitting and adjustment of other specified devices"
"Z434",10,"Encounter for attention to other artificial openings of digestive tract"
"Z8546",10,"Personal history of malignant neoplasm of prostate"
"I6521",10,"Occlusion and stenosis of right carotid artery"
"Z8571",10,"Personal history of Hodgkin lymphoma"
"Z952",10,"Presence of prosthetic heart valve"
"V4581",9,"Aortocoronary bypass status"
"V422",9,"Heart valve replaced by transplant"
"V422",10,"Person on outside of car injured in collision with two- or three-wheeled motor vehicle in nontraffic accident"
"20190",9,"Hodgkin's disease, unspecified type, unspecified site, extranodal and solid organ sites"
"I6522",10,"Occlusion and stenosis of left carotid artery"
"V1079",9,"Personal history of other lymphatic and hematopoietic neoplasms"
"V4579",9,"Other acquired absence of organ"
"V1072",9,"Personal history of hodgkin's disease"
"3968",9,"Multiple involvement of mitral and aortic valves"
"F28",10,"Other psychotic disorder not due to a substance or known physiological condition"
"F319",10,"Bipolar disorder, unspecified"
"K047",10,"Periapical abscess without sinus"
"F5001",10,"Anorexia nervosa, restricting type"
"E038",10,"Other specified hypothyroidism"
"R1312",10,"Dysphagia, oropharyngeal phase"
"F514",10,"Sleep terrors [night terrors]"
"F1220",10,"Cannabis dependence, uncomplicated"
"T17920A",10,"Food in respiratory tract, part unspecified causing asphyxiation, initial encounter"
"T4275XA",10,"Adverse effect of unspecified antiepileptic and sedative-hypnotic drugs, initial encounter"
"R490",10,"Dysphonia"
"I4581",10,"Long QT syndrome"
"Z1639",10,"Resistance to other specified antimicrobial drug"
"I2602",10,"Saddle embolus of pulmonary artery with acute cor pulmonale"
"F603",10,"Borderline personality disorder"
"W1830XD",10,"Fall on same level, unspecified, subsequent encounter"
"J309",10,"Allergic rhinitis, unspecified"
"M720",10,"Palmar fascial fibromatosis [Dupuytren]"
"F209",10,"Schizophrenia, unspecified"
"L570",10,"Actinic keratosis"
"Z8674",10,"Personal history of sudden cardiac arrest"
"L409",10,"Psoriasis, unspecified"
"M810",10,"Age-related osteoporosis without current pathological fracture"
"J95811",10,"Postprocedural pneumothorax"
"H269",10,"Unspecified cataract"
"H6120",10,"Impacted cerumen, unspecified ear"
"G931",10,"Anoxic brain damage, not elsewhere classified"
"S42291D",10,"Other displaced fracture of upper end of right humerus, subsequent encounter for fracture with routine healing"
"I82621",10,"Acute embolism and thrombosis of deep veins of right upper extremity"
"M542",10,"Cervicalgia"
"R45851",10,"Suicidal ideations"
"Z9114",10,"Patient's other noncompliance with medication regimen"
"B20",10,"Human immunodeficiency virus [HIV] disease"
"S0990XA",10,"Unspecified injury of head, initial encounter"
"F10129",10,"Alcohol abuse with intoxication, unspecified"
"E162",10,"Hypoglycemia, unspecified"
"V620",9,"Unemployment"
"V620",10,"Driver of heavy transport vehicle injured in collision with two- or three-wheeled motor vehicle in nontraffic accident"
"3559",9,"Mononeuritis of unspecified site"
"30560",9,"Cocaine abuse, unspecified"
"V1552",9,"Personal history of traumatic brain injury"
"30001",9,"Panic disorder without agoraphobia"
"V6284",9,"Suicidal ideation"
"V600",9,"Lack of housing"
"V600",10,"Driver of heavy transport vehicle injured in collision with pedestrian or animal in nontraffic accident"
"7801",9,"Hallucinations"
"30590",9,"Other, mixed, or unspecified drug abuse, unspecified"
"F1099",10,"Alcohol use, unspecified with unspecified alcohol-induced disorder"
"Z87820",10,"Personal history of traumatic brain injury"
"F1490",10,"Cocaine use, unspecified, uncomplicated"
"F1994",10,"Other psychoactive substance use, unspecified with psychoactive substance-induced mood disorder"
"29284",9,"Drug-induced mood disorder"
"6253",9,"Dysmenorrhea"
"29633",9,"Major depressive affective disorder, recurrent episode, severe, without mention of psychotic behavior"
"30553",9,"Opioid abuse, in remission"
"37950",9,"Nystagmus, unspecified"
"2511",9,"Other specified hypoglycemia"
"F29",10,"Unspecified psychosis not due to a substance or known physiological condition"
"F1910",10,"Other psychoactive substance abuse, uncomplicated"
"Z21",10,"Asymptomatic human immunodeficiency virus [HIV] infection status"
"F1110",10,"Opioid abuse, uncomplicated"
"F1410",10,"Cocaine abuse, uncomplicated"
"33819",9,"Other acute pain"
"24900",9,"Secondary diabetes mellitus without mention of complication, not stated as uncontrolled, or unspecified"
"V443",9,"Colostomy status"
"V443",10,"Unspecified car occupant injured in collision with heavy transport vehicle or bus in nontraffic accident"
"78909",9,"Abdominal pain, other specified site"
"1179",9,"Other and unspecified mycoses"
"5778",9,"Other specified diseases of pancreas"
"V1279",9,"Personal history of other diseases of digestive system"
"6930",9,"Dermatitis due to drugs and medicines taken internally"
"5771",9,"Chronic pancreatitis"
"45385",9,"Acute venous embolism and thrombosis of subclavian veins"
"Z981",10,"Arthrodesis status"
"V499XXA",10,"Car occupant (driver) (passenger) injured in unspecified traffic accident, initial encounter"
"S22069A",10,"Unspecified fracture of T7-T8 vertebra, initial encounter for closed fracture"
"G43909",10,"Migraine, unspecified, not intractable, without status migrainosus"
"M40209",10,"Unspecified kyphosis, site unspecified"
"S22059A",10,"Unspecified fracture of T5-T6 vertebra, initial encounter for closed fracture"
"S22049A",10,"Unspecified fracture of fourth thoracic vertebra, initial encounter for closed fracture"
"V270XXA",10,"Motorcycle driver injured in collision with fixed or stationary object in nontraffic accident, initial encounter"
"S271XXA",10,"Traumatic hemothorax, initial encounter"
"F1290",10,"Cannabis use, unspecified, uncomplicated"
"S066X0A",10,"Traumatic subarachnoid hemorrhage without loss of consciousness, initial encounter"
"S12600A",10,"Unspecified displaced fracture of seventh cervical vertebra, initial encounter for closed fracture"
"S240XXA",10,"Concussion and edema of thoracic spinal cord, initial encounter"
"S32029A",10,"Unspecified fracture of second lumbar vertebra, initial encounter for closed fracture"
"E041",10,"Nontoxic single thyroid nodule"
"Y92488",10,"Other paved roadways as the place of occurrence of the external cause"
"V8609XS",10,"Driver of other special all-terrain or other off-road motor vehicle injured in traffic accident, sequela"
"M25511",10,"Pain in right shoulder"
"F1210",10,"Cannabis abuse, uncomplicated"
"29281",9,"Drug-induced delirium"
"7102",9,"Sicca syndrome"
"E9393",9,"Other antipsychotics, neuroleptics, and major tranquilizers causing adverse effects in therapeutic use"
"S79912A",10,"Unspecified injury of left hip, initial encounter"
"H04123",10,"Dry eye syndrome of bilateral lacrimal glands"
"Z961",10,"Presence of intraocular lens"
"Y92129",10,"Unspecified place in nursing home as the place of occurrence of the external cause"
"E049",10,"Nontoxic goiter, unspecified"
"M5030",10,"Other cervical disc degeneration, unspecified cervical region"
"M4856XA",10,"Collapsed vertebra, not elsewhere classified, lumbar region, initial encounter for fracture"
"W1839XA",10,"Other fall on same level, initial encounter"
"H53143",10,"Visual discomfort, bilateral"
"S4992XA",10,"Unspecified injury of left shoulder and upper arm, initial encounter"
"M3500",10,"Sicca syndrome, unspecified"
"M8008XA",10,"Age-related osteoporosis with current pathological fracture, vertebra(e), initial encounter for fracture"
"K922",10,"Gastrointestinal hemorrhage, unspecified"
"V1261",9,"Personal history of pneumonia (recurrent)"
"2469",9,"Unspecified disorder of thyroid"
"E8859",9,"Fall from other slipping, tripping, or stumbling"
"82009",9,"Other closed transcervical fracture of neck of femur"
"42843",9,"Acute on chronic combined systolic and diastolic heart failure"
"03843",9,"Septicemia due to pseudomonas"
"0383",9,"Septicemia due to anaerobes"
"5768",9,"Other specified disorders of biliary tract"
"4739",9,"Unspecified sinusitis (chronic)"
"5809",9,"Acute glomerulonephritis with unspecified pathological lesion in kidney"
"48249",9,"Other Staphylococcus pneumonia"
"5829",9,"Chronic glomerulonephritis with unspecified pathological lesion in kidney"
"E9383",9,"Intravenous anesthetics causing adverse effects in therapeutic use"
"34290",9,"Hemiplegia, unspecified, affecting unspecified side"
"40300",9,"Hypertensive chronic kidney disease, malignant, with chronic kidney disease stage I through stage IV, or unspecified"
"0416",9,"Proteus (mirabilis) (morganii) infection in conditions classified elsewhere and of unspecified site"
"3129",9,"Unspecified disturbance of conduct"
